Season,Episode,Title,Description,AirDate,Rating,Voters
1,1,Pilot,"It's the year 2030 and an older Ted Mosby is telling the story to his son and daughter about how he met and will eventually marry their mother. This is where we meet for the first time Ted, Lily, Marshall, Barney and Robin.",19 Sep. 2005,8.4,"(6,323)"
1,2,Purple Giraffe,"Ted throws a party in hopes of seeing Robin again, but when she doesn't show up, he throws another... and another.",26 Sep. 2005,8.0,"(4,849)"
1,3,The Sweet Taste of Liberty,"Barney's plan to meet girls at the airport backfires as he and Ted are picked up by airport security. Meanwhile, Lily gets jealous of Robin.",3 Oct. 2005,8.0,"(4,601)"
1,4,Return of the Shirt,Ted reconnects with an old flame and soon remembers why he dumped her in the first place. Barney pays Robin to say outrageous things on the air.,10 Oct. 2005,7.9,"(4,338)"
1,5,Okay Awesome,"Robin, Ted, and Barney go to a hot new club, leaving the engaged Marshall and Lily to a more adult, albeit boring, evening of wine tasting.",17 Oct. 2005,8.2,"(4,467)"
1,6,The Slutty Pumpkin,"Marshall and Lily enter a Halloween costume party and Robin brings her new boyfriend. Ted and Barney go to the same Halloween party they go to every year where Ted looks for his lost love, the Slutty Pumpkin.",24 Oct. 2005,8.0,"(4,309)"
1,7,Matchmaker,"When Ted signs up with a matchmaking service, he learns that love is not a science. Marshall and Lily confront a creature living in their apartment.",7 Nov. 2005,7.6,"(4,058)"
1,8,The Duel,"Lily moves in with Marshall and Ted, and when Ted suspects that he's being edged out of the apartment, he and Marshall decide to settle it like men.",14 Nov. 2005,8.0,"(4,039)"
1,9,Belly Full of Turkey,"Thanksgiving with Marshall's family is stressful when Lily thinks she might be pregnant. Robin, Barney, and Ted spend the holiday volunteering.",21 Nov. 2005,7.9,"(4,015)"
1,10,The Pineapple Incident,"After an alcohol-induced blackout, Ted awakens to find a strange woman and a pineapple in his bed.",28 Nov. 2005,9.1,"(6,082)"
1,11,The Limo,"It's New Year's Eve 2005 and Ted spends a large portion of his Christmas bonus for a limo for him and the gang. In addition, he has outlined a plan for how they will ring in the New Year. Unfortunately, things don't always go as planned.",19 Dec. 2005,8.2,"(4,228)"
1,12,The Wedding,"Ted's romantic hopes are dashed when he invites Robin to a fancy wedding, only to discover that the bride-to-be won't allow him to bring a date.",9 Jan. 2006,8.0,"(3,933)"
1,13,"Drumroll, Please","Robin is emotionally torn when Ted meets an exciting new woman, Victoria, at the wedding. Afterward, though, he doesn't know how to contact her.",23 Jan. 2006,8.6,"(4,482)"
1,14,"Zip, Zip, Zip","Hiding in the bathroom, Marshall and Lily wait for Ted and Victoria to consummate their relationship, and Barney gets the wrong idea from Robin.",6 Feb. 2006,8.1,"(3,848)"
1,15,Game Night,Marshall's game night leads to some startling and very embarrassing revelations.,27 Feb. 2006,9.0,"(4,986)"
1,16,Cupcake,"Just as Ted and Victoria's relationship is beginning to flourish, she's offered a scholarship to a culinary institute in Germany.",6 Mar. 2006,7.8,"(3,682)"
1,17,Life Among the Gorillas,"With Victoria in Germany, Ted faces the pitfalls of long-distance relationships. Marshall has trouble fitting in at Barney's company.",20 Mar. 2006,7.6,"(3,651)"
1,18,Nothing Good Happens After 2 AM,"With Victoria on his mind, Ted has conflicted feelings when Robin invites him over for a late-night rendevouz.",10 Apr. 2006,8.4,"(4,067)"
1,19,Mary the Paralegal,"Ted needs a date to take to Robin's awards banquet, so Barney hooks him up with Mary, who may be a call girl.",24 Apr. 2006,8.7,"(4,361)"
1,20,Best Prom Ever,"With her wedding day fast approaching, Lily, along with Barney and Robin, crashes a high school prom to scope out a potential band for the reception.",1 May 2006,7.7,"(3,651)"
1,21,Milk,"Ted is excited when a matchmaking service claims to have found his soul mate, but he postpones his date to help Lily, who has a surprising revelation.",8 May 2006,8.0,"(3,682)"
1,22,Come On,Ted makes a final attempt to win Robin's heart. Marshall and Lily's relationship is in jeopardy.,15 May 2006,8.7,"(4,528)"
2,1,Where Were We?,Marshall becomes predictably depressed and pathetic after the breakup. And it only gets worse when he discovers that Lily may be back in town.,18 Sep. 2006,8.0,"(3,657)"
2,2,The Scorpion and the Toad,"Barney gets Marshall back out on the singles market, but Barney keeps taking all the prospects from him. And Ted's convinced that Lily is back because she wants Marshall back, even though she says she's never been better.",25 Sep. 2006,8.1,"(3,575)"
2,3,Brunch,"Ted discovers that his parents are keeping a secret from him after his dad acts as Barney's wingman, and Marshall and Lily intentionally try to get each other sexually aroused.",2 Oct. 2006,8.4,"(3,727)"
2,4,"Ted Mosby, Architect",Barney tells Ted that single women like architects. But will Ted use this useful tidbit of information to cheat on Robin after they have their first fight?,9 Oct. 2006,8.7,"(4,191)"
2,5,World's Greatest Couple,"Lily gets introduced to Barney's bachelor pad when she needs a place to stay, and Marshall finds a unlikely new friend to join him for brunch, concerts and musicals.",16 Oct. 2006,8.7,"(4,004)"
2,6,Aldrin Justice,"Ted gets Lily a job at his firm, but she only makes trouble for Ted when he refuses to stand up to his boss. And Barney sleeps with Marshall's law school professor to help his grades, but she's less than impressed with his prowess.",23 Oct. 2006,8.0,"(3,563)"
2,7,Swarley,"The guys tell Marshall to stay away from his new date because she has ""crazy eyes,"" but she couldn't be any crazier than Lily after she learns that Marshall's going out on his first new date.",6 Nov. 2006,8.9,"(4,948)"
2,8,Atlantic City,"Marshall and Lily elope to Atlantic City, but they discover that getting married in Atlantic City isn't as easy as getting married in Las Vegas.",13 Nov. 2006,7.8,"(3,552)"
2,9,Slap Bet,"The gang discovers that Robin's been hiding a huge secret, but they have no idea what it is. Marshall thinks she is married, and Barney thinks she was a porn star.",20 Nov. 2006,9.4,"(7,205)"
2,10,Single Stamina,"Barney's gay black brother is in town, but he doesn't want to tell Barney that he's getting married because he'll be losing his only single sidekick.",27 Nov. 2006,8.0,"(3,549)"
2,11,How Lily Stole Christmas,"Lily takes away her Christmas display after she finds out that Ted called her a bad name while she was broken up with Marshall, and Barney is too sick for his Christmas plans.",11 Dec. 2006,8.0,"(3,542)"
2,12,First Time in New York,"Robin tries to keep her younger sister from losing her virginity while on vacation in New York, which causes everyone to reminisce about their first times.",8 Jan. 2007,8.0,"(3,613)"
2,13,Columns,"Barney asks Lily to paint a nude picture of him after finding her painting of Marshall. And Ted can't find an opportune time to fire his old boss, who now works for him but still keeps undermining his work.",22 Jan. 2007,7.8,"(3,330)"
2,14,Monday Night Football,"Everybody misses the Super Bowl because of a funeral. Therefore, they all try to go 24 hours without finding out who won so that they can watch the game together on Monday night.",5 Feb. 2007,8.3,"(3,586)"
2,15,Lucky Penny,"When Ted misses his important business trip to Chicago, he tries to trace his steps back to the original incident that triggered the series of events that made him miss the flight.",12 Feb. 2007,8.3,"(3,527)"
2,16,Stuff,"Ted tries to get rid of everything he received from other women at Robin's request, but getting rid of the stuff Robin received from other men won't be as easy. Meanwhile, Barney gets revenge on Lily for making him attend her terrible play.",19 Feb. 2007,8.4,"(3,696)"
2,17,"Arrivederci, Fiero","When Marshall's car doesn't quite make it to 200,000 miles without dying completely, everybody reminisces about their greatest memories with the car.",26 Feb. 2007,8.1,"(3,566)"
2,18,Moving Day,"Ted and Robin decide to move in together, but nobody appears to be happy with the new living arrangements--especially Barney.",19 Mar. 2007,7.9,"(3,325)"
2,19,Bachelor Party,"Ted changes Barney's bachelor party plans for Marshall at the last minute, so that it won't just consist of gambling and cheap strippers. And Robin gets Lily an inappropriate shower party gift.",9 Apr. 2007,8.3,"(3,519)"
2,20,Showdown,"Barney becomes a contestant on ""The Price Is Right"" so that he can confront Bob Barker, because he believes that the game show host is his biological father.",30 Apr. 2007,8.8,"(3,872)"
2,21,Something Borrowed,"Marshall and Lily's wedding is destined to become a disaster, until fate intervenes and makes it perfect.",7 May 2007,8.7,"(3,667)"
2,22,Something Blue,"As the happy couple celebrate their wedding, Ted and Robin tell Barney about the latest development of their relationship.",14 May 2007,8.7,"(3,721)"
3,1,Wait for It,"Ted's still not ready to date months after his breakup with Robin. But when Robin returns to New York with an exotic new boyfriend, he decides it's time to finally do something adventurous.",24 Sep. 2007,8.1,"(3,644)"
3,2,We're Not from Here,"Ted and Barney pose as tourists to pick up on a couple of New York women, and Robin starts getting fed up with her new boyfriend.",1 Oct. 2007,7.5,"(3,255)"
3,3,Third Wheel,"Ted has a chance for a threesome with two women, but Barney and Lily try to sabotage it. Meanwhile, Robin's date also goes better than expected, if only she can find a razor.",8 Oct. 2007,8.0,"(3,418)"
3,4,Little Boys,"Robin tries to date a guy with a child, even though she does not like or want children. Meanwhile, Ted finds it impossible to make it with a woman he knows that Barney slept with a year ago.",15 Oct. 2007,7.6,"(3,234)"
3,5,How I Met Everyone Else,"While everyone meets Ted's new crazy girlfriend, everyone recounts their stories of how they met everyone else. But the stories turn out to have several inconsistencies.",22 Oct. 2007,8.9,"(4,518)"
3,6,I'm Not That Guy,"Ted discovers that a porn star is using his name. Marshall is wined and dined by a firm that defends polluters, and Lily's spending habits may force him to take the job.",29 Oct. 2007,7.9,"(3,213)"
3,7,Dowisetrepla,"Marshall and Lily decide to buy a new home, which forces Lily to finally confront Marshall about her credit card debt.",5 Nov. 2007,7.9,"(3,251)"
3,8,Spoiler Alert,"The guys shatter Ted's impressions of his new girlfriend by telling him she talks too much. Ted responds by turning the tables on his friends, and they react by pointing out Ted's worst flaw.",12 Nov. 2007,9.0,"(4,497)"
3,9,Slapsgiving,"Marshall warns Barney that the third slap in their ""slap bet"" will be coming on Thanksgiving night. Meanwhile, Ted and Robin sleep together on the night before Thanksgiving.",19 Nov. 2007,8.9,"(4,315)"
3,10,The Yips,Barney has trouble hitting on women at the Victoria's Secret after party and so has to return to the woman who took his virginity.,26 Nov. 2007,7.8,"(3,282)"
3,11,The Platinum Rule,Barney and the gang try to convince Ted not to date the doctor that is removing his tattoo by giving examples of the Platinum Rule.,10 Dec. 2007,8.4,"(3,454)"
3,12,No Tomorrow,"On St-Patrick's Day, Ted follows Barney to a bar to party like there's no tomorrow, while Robin discovers something strange about Marshall and Lily's new apartment.",17 Mar. 2008,8.0,"(3,328)"
3,13,Ten Sessions,"As the search for Mrs. Right continues, Ted woos his dermatologist Stella -- but her receptionist, Abby, seems more interested in him.",24 Mar. 2008,8.7,"(3,978)"
3,14,The Bracket,"One of Barney's exes is sabotaging his love life, but he doesn't know who. So he makes a NCAA Basketball Tournament-style bracket to figure out which women he wronged the worst.",31 Mar. 2008,8.6,"(3,530)"
3,15,The Chain of Screaming,"Marshall cries in front of his boss after he chews him out, and everybody gives Marshall their own unique advice on how to confront his boss about the situation.",14 Apr. 2008,7.8,"(3,178)"
3,16,Sandcastles in the Sand,"Robin gives romance a second try with an old boyfriend, only to have him break her heart...again.",21 Apr. 2008,8.1,"(3,493)"
3,17,The Goat,"Barney is upset because he violated his own ""bro code"" by sleeping with Robin. How will Ted react when he learns that Barney slept with his ex-girlfriend?",28 Apr. 2008,8.1,"(3,230)"
3,18,Rebound Bro,"Barney finds a new wingman to replace Ted, but he's painfully shy and awkward around women. Meanwhile Ted discovers that his new girlfriend Stella hasn't had sex in 5 years.",5 May 2008,8.0,"(3,169)"
3,19,Everything Must Go,"Barney helps Abby get back at Ted by staging a fake proposal, but Abby doesn't realize that it's fake. Lily decides to sell some of her paintings so that she and Marshall can pay for floor repairs at their new place.",12 May 2008,7.6,"(3,161)"
3,20,Miracles,"Ted breaks up with Stella but immediately wants to take it back after a life-changing experience. However, Stella doesn't realize that he broke up with her. Meanwhile, Barney has a serious accident on his way to see Ted in the hospital.",19 May 2008,8.5,"(3,488)"
4,1,Do I Know You?,"Ted and Stella get engaged, but Ted soon learns that he doesn't know anything about her. Meanwhile, Barney confesses to Lily that he's in love with Robin",22 Sep. 2008,8.5,"(3,653)"
4,2,The Best Burger in New York,"Marshall claims that he had the best hamburger in the world during his first week in New York City, but he forgot where the burger joint is located. The gang then hits the streets of Manhattan to help him find it.",29 Sep. 2008,8.4,"(3,860)"
4,3,I Heart NJ,Ted does not want to move in with Stella because he hates New Jersey. Robin prematurely quits her TV job because she incorrectly thinks that she already has a new job.,6 Oct. 2008,7.6,"(3,166)"
4,4,Intervention,"Ted, Robin, Marshall, and Lily all begin getting cold feet because of their imminent life changes, and Barney tries to prove that he can pick up a woman while posing as an 80-year-old man.",13 Oct. 2008,8.7,"(3,808)"
4,5,Shelter Island,"Ted and Stella move up their wedding date, but the wedding may not go off as planned after Ted breaks the ""No Exes Rule"" and invites Robin to come in from Japan for the wedding.",20 Oct. 2008,8.2,"(3,322)"
4,6,Happily Ever After,The gang tries to hide from Stella when they discover that they are eating at the same restaurant.,3 Nov. 2008,7.9,"(3,159)"
4,7,Not a Father's Day,"While Barney celebrates a pregnancy false alarm, Marshall and Lily try to figure out if it's time to have a baby.",10 Nov. 2008,7.7,"(3,094)"
4,8,Woooo!,"Lily is disappointed to discover that Robin is secretly a ""Woooo! Girl,"" and Barney secretly sabotages Ted's chance to get the contract to design a new bank skyscraper.",17 Nov. 2008,7.9,"(3,299)"
4,9,The Naked Man,"When the gang learns that a bold, desperation date move got Robin into bed, Ted and Barney decide to try it out for themselves.",24 Nov. 2008,9.1,"(5,193)"
4,10,The Fight,"The guys get invited to fight alongside Doug the Bartender. However, the fight doesn't go exactly how they imagined it to.",8 Dec. 2008,8.2,"(3,292)"
4,11,Little Minnesota,"Ted tries to keep his irresponsible sister from hooking up with Barney during her trip to New York, and Robin starts hanging out with Marshall at a bar for Minnesotans, not telling them that she's really Canadian.",15 Dec. 2008,8.0,"(3,234)"
4,12,Benefits,"Ted and Robin discover that sex with each other solve their fights as roommates, which makes Barney very jealous and angry. Meanwhile, Marshall reveals that he's too embarrassed to use the office bathroom.",12 Jan. 2009,8.5,"(3,491)"
4,13,Three Days of Snow,"Ted and Barney get an opportunity to run their own bar during a historic blizzard, while Marshall and Lily try to defy the odds and continue one of their cherished traditions.",19 Jan. 2009,8.4,"(3,448)"
4,14,The Possimpible,"Robin needs to find a television job in seven days or else she loses her work visa, and Barney volunteers to come to her aid. Meanwhile, Ted, Marshall, and Lily consider cleaning up their resumes",2 Feb. 2009,8.2,"(3,295)"
4,15,The Stinsons,"The guys find out that Barney is pretending to have a wife and son to make his mother happy, but the charade is blown when Ted makes a move on Barney's ""wife.""",2 Mar. 2009,8.2,"(3,360)"
4,16,"Sorry, Bro","Ted meets with his ex-girlfriend from college--a girlfriend who cheated on him constantly and Marshall and Lily can't stand, and Marshall tells the story about how he forgot to bring his pants to work.",9 Mar. 2009,7.6,"(3,186)"
4,17,The Front Porch,"Ted becomes angry with Lily when he finds out that she has been sabotaging all his relationships that she did not approve of, including his relationship with Robin.",16 Mar. 2009,8.2,"(3,330)"
4,18,Old King Clancy,"Barney and Marshall don't tell Ted that the plans for the building he has been working on have been scrapped, and the guys try to figure out which Canadian celebrity Robin slept with.",23 Mar. 2009,7.5,"(3,032)"
4,19,Murtaugh,"Barney tries to do all the items on Ted's ""I'm too old for this stuff"" list while Marshall's over-competitive side comes out when he coaches Lily's kindergarten basketball team.",30 Mar. 2009,8.3,"(3,311)"
4,20,Mosbius Designs,"Ted's plans to make his own design firm in his apartment hit a snag when his personal assistant begins sleeping with Robin, and Marshall tries to find a way to make himself indispensable at his workplace.",13 Apr. 2009,7.5,"(3,075)"
4,21,The Three Days Rule,"Ted gets around the three-day rule by texting a woman he just met, but he doesn't realize that he's actually texting Barney and Marshall.",27 Apr. 2009,8.6,"(3,461)"
4,22,Right Place Right Time,Ted recounts the series of random events that lead up to the chance meeting with the woman who would eventually become his wife.,4 May 2009,8.1,"(3,179)"
4,23,As Fast as She Can,"Stella's boyfriend Tony breaks up with her after having a conversation with Ted, prompting Stella to come back to Ted with a surprising request.",11 May 2009,7.6,"(3,098)"
4,24,The Leap,"While Ted struggles with an unorthodox architecture project, Robin finds out that Barney is in love with her, and Marshall threatens to take a long-considered leap from the roof to a neighboring building.",18 May 2009,8.6,"(3,643)"
5,1,Definitions,"As Ted begins his new career as a professor and is about to meet his future wife, Lily forces Barney and Robin to have ""the talk"" and define their new relationship.",21 Sep. 2009,8.4,"(3,484)"
5,2,Double Date,"Ted goes on a blind date with the same woman he went on a blind date with seven years ago, and Barney and Marshall find Lily's stripper look-alike.",28 Sep. 2009,8.0,"(3,155)"
5,3,Robin 101,"When Robin fears that Barney is cheating on her, she soon discovers that he is spending his evenings with Ted learning everything there is to know on how to date her",5 Oct. 2009,8.2,"(3,265)"
5,4,The Sexless Innkeeper,"When Lily and Marshall realize that Robin and Barney are the perfect double-date friends, they try too hard to impress and come on too strong. Meanwhile, Ted gets a new nickname from Barney after an unsuccessful hook-up.",12 Oct. 2009,7.8,"(3,309)"
5,5,Duel Citizenship,"While Barney tries to convince Robin to become an American citizen, Ted and Marshall's fabled road trip takes a wrong turn when Marshall invites Lily.",19 Oct. 2009,7.6,"(3,127)"
5,6,Bagpipes,"Despite their best efforts to be the perfect couple, Barney's know-it-all attitude gets him in trouble with Robin and they are forced to ask Marshall and Lily for relationship advice.",2 Nov. 2009,7.6,"(2,998)"
5,7,The Rough Patch,"After Barney and Robin hit a rough patch in their relationship, Lily devises the perfect plan to break them up, calling in help from Robin's famous friend, Alan Thicke.",9 Nov. 2009,7.6,"(3,170)"
5,8,The Playbook,"When Barney hooks up with a woman Lily had been saving for Ted, she gets revenge by stealing his ""playbook,"" which contains all the moves he uses to pick up women. But will Barney have the last laugh?",16 Nov. 2009,9.3,"(6,641)"
5,9,Slapsgiving 2: Revenge of the Slap,"Barney freaks out when Marshall bequeaths a ""slap bet"" slap to Ted and Robin. Meanwhile, Lily's estranged father shows up for Thanksgiving.",23 Nov. 2009,7.8,"(3,289)"
5,10,The Window,"Maggie a girl next door Ted has wanted to date for years has suddenly broken up with her latest boyfriend, giving him and many other guys a chance to score with her.",7 Dec. 2009,8.0,"(3,195)"
5,11,Last Cigarette Ever,The gang struggles to quit smoking while Robin clashes with her new jaded co-worker.,14 Dec. 2009,7.7,"(3,350)"
5,12,Girls vs. Suits,"Barney chooses between wearing suits and sleeping with a sexy bartender. Meanwhile, Ted gets ever closer to meeting ""the mother"".",11 Jan. 2010,9.0,"(5,248)"
5,13,Jenkins,"When Marshall finds out he's the ""reacher"" in his relationship with Lily and not the ""settler,"" he considers pursuing a sexy and cool female coworker. Meanwhile, Ted finds out Robin is a drinking game for his architecture students.",18 Jan. 2010,8.5,"(3,540)"
5,14,Perfect Week,When Barney is about to complete the perfect week - landing seven different girls in seven days - the gang roots him on in order to forget about their own miserable week.,1 Feb. 2010,8.7,"(3,821)"
5,15,Rabbit or Duck,"Barney runs into problems when he displays his cell phone number during the Super Bowl, Ted asks Marshall and Lily to arrange a marriage for him, and Robin thinks that her co-anchor has asked her out on a date.",8 Feb. 2010,7.9,"(3,122)"
5,16,Hooked,"When the gang tries to convince Ted that he is being strung along by Tiffany, they reflect about relationships where each of them has been in the same situation.",1 Mar. 2010,7.6,"(3,067)"
5,17,Of Course,"After the guys discover that Robin deliberately got Barney hooked up with an incompatible female writer, they find out that that they didn't realize that Robin hasn't been handling their breakup very well.",8 Mar. 2010,8.2,"(3,425)"
5,18,Say Cheese,"Ted angers Lily when he brings a random date to her birthday party, so she is forced to remind him of all the other random women he has brought along to important functions, only to discover that they weren't ""the one.""",22 Mar. 2010,8.1,"(3,159)"
5,19,Zoo or False,"Marshall comes up with a number of different outrageous and embarrassing stories to explain how he was mugged in Central Park, but which of his stories is the truth?",12 Apr. 2010,7.5,"(3,066)"
5,20,Home Wreckers,"Ted reacts to his mom's second wedding by making the capricious decision to buy his ""dream house,"" while everyone tries to figure out whether Barney or Robin cried at the wedding.",19 Apr. 2010,7.7,"(3,040)"
5,21,Twin Beds,"As Robin contemplates moving in with her new boyfriend Don, Ted and Barney both decide that they want her back. Meanwhile, Marshall and Lily think they've revolutionized modern marriage when they begin sleeping in separate beds.",3 May 2010,7.6,"(2,965)"
5,22,Robots vs. Wrestlers,"Barney is worried that the old gang is falling apart when Ted blows off a ""Wrestlers vs. Robots"" competition so that he can stay at a snobby party.",10 May 2010,8.1,"(3,169)"
5,23,The Wedding Bride,"Ted is livid when he discovers that the man Stella left Ted for at the altar wrote a blockbuster movie about the incident, and portrays Ted as the bumbling, mean-spirited bad guy.",17 May 2010,7.9,"(3,323)"
5,24,Doppelgangers,"Marshall and Lily think they've spotted Barney's doppelganger, which means that they can start trying to have a baby, but it's really Barney in disguise. Meanwhile, Ted goes blonde and Robin considers taking an anchor job in Chicago.",24 May 2010,8.4,"(3,249)"
6,1,Big Days,"Ted musters up the courage to talk to a girl at the bar, but then discovers she's there with one of his exes. Meanwhile, Lily is mad at Marshall because he told his dad they're trying to have a baby, and Robin lets herself go.",20 Sep. 2010,8.0,"(3,294)"
6,2,Cleaning House,"The gang accompanies Barney and his brother James after they find the man who may be Barney's father, but it turns out to be James' father instead.",27 Sep. 2010,8.2,"(3,354)"
6,3,Unfinished,"When Ted declines Barney's offer to design the new GNB building, Barney tries to woo him by using all of his best womanizing tactics. Meanwhile, Robin is still not over her relationship with Don and drunk dials him.",4 Oct. 2010,7.6,"(3,004)"
6,4,Subway Wars,"The guys race each other, each using a different form of transportation, from the pub to a restaurant seven miles away because a friend claims that Woody Allen is there.",11 Oct. 2010,8.5,"(3,520)"
6,5,Architect of Destruction,"Is Ted having second thoughts about designing GNB's new skyscraper because it would tear down a landmark, or because he's trying to impress a woman? Meanwhile, Lily shares a secret about Robin's new boyfriend with Marshall.",18 Oct. 2010,7.6,"(2,947)"
6,6,Baby Talk,"Marshall takes steps to make sure that he and Lily have a baby boy, but Lily has other ideas. Meanwhile, when Ted begins dating Robin's co-anchor, Barney is inspired to use baby talk to pick up women, and Robin feels betrayed.",25 Oct. 2010,7.6,"(2,956)"
6,7,Canning Randy,"Marshall struggles to fire an incompetent employee, everyone tries to figure out whom Robin slept with Halloween night, and Zoey, the GNB skyscraper protester, finds a way to turn Ted's class against him.",1 Nov. 2010,7.5,"(2,911)"
